
<!-- DTD pour le fichier des scope-note  -->

<!ELEMENT SCOPE_NOTE (RECORD+)>

<!ELEMENT RECORD (DESCRIPTEUR_ID, SN)>

<!ELEMENT DESCRIPTEUR_ID	(#PCDATA)>

<!ELEMENT SN					(#PCDATA)>

<!ATTLIST SCOPE_NOTE

			LNG					CDATA		#REQUIRED
			VERSION				CDATA		#REQUIRED >
